ref_id,short_name,authors,year,title,journal,doi,key_data_points
R001,Bairner2016,Bairner et al.,2016,The ins and outs of US youth soccer: learning about loyalty and success,Soccer & Society,10.1080/14660970.2016.1267620,"Club soccer costs $1k-$10k/yr; camps add $500+/week; 1/3 of participants from families >$75k/yr; only 11% from <$25k/yr; financial returns rarely recoup investment"
R002,Bocarro2018,Bocarro et al.,2018,Socioeconomic status of parents with children participating on youth club sport teams,Physical Therapy in Sport,10.1016/j.ptsp.2018.05.014,"n=949 Wisconsin parents; median annual club sport spend $1500 (IQR $500-$3000); school sports $200/yr; 60% of families earn >$100k/yr; 70%+ have bachelors degree; only 8% earn <$50k/yr"
R003,Svensson2019,Svensson et al.,2019,Why Can't We All Just Get Along? The Conflict between School and Club Sports in the United States,Quest,10.1080/00336297.2019.1627561,"Youth sports industry estimated at $17 billion; club vs school system conflict; pay-to-play exclusion of lower-income families; lack of diversity in sport"
R004,Beutler2014,Beutler et al.,2014,Comparing the practices of US Soccer against a global model for integrated development of mass and high-performance sport,Managing Leisure,10.1080/13606719.2014.929402,"Coaches cite high costs as top challenge; limited scholarships exclude many; residential academies primarily serve those who can pay; fragmented US development pathway; short collegiate season problematic"
R005,Beron2019,Beron et al.,2019,Does birth date influence career attainment in professional soccer?,Science and Medicine in Football,10.1080/24733938.2019.1696471,"n=1071 academy players; only 40 (4.7%) reached professional first team; Relative Age Effect (RAE): Q1 (Jan-Mar) players overrepresented; Q4 (Oct-Dec) players who persist have 3x odds of going pro"
R006,Watanabe2010,Watanabe et al.,2010,From One-and-Done to Seasoned Veterans: A Demographic Analysis of Individual Career Length in Major League Soccer,Journal of Quantitative Analysis in Sports,10.2202/1559-0410.1261,"n=~1100 MLS players 1996-2007; initial career expectancy 2.4 years; ~30% exit after 1 season; annual exit rate never below 12%; foreign-born players 2.2x exit odds vs US-born; by year 4 expected remaining career 2.6 more years (~6.6 total)"
R007,Berkowitz2015,Berkowitz et al.,2015,Willingness to Pay for Soccer Player Development in the United States,Journal of Sports Economics,10.1177/1527002515611463,"US Soccer Development Academy designed to bypass college; direct pro pathway; MLS Homegrown Player Initiatives; youth academies for early talent ID"
R008,Dure2018,Dure et al.,2018,Footballers migrants and scholars: the globalization of US mens college soccer,Soccer & Society,10.1080/14660970.2017.1419469,"7600 international players from 170 countries in mens college soccer (2016); 120% increase since 2000; 20% of total player pool; UK provides 21% of all international hometowns; 38000 mens college soccer players total; only 1800 pro roster spots across all US tiers; NCAA D1 24% international (up from 10% in 2005); NAIA 35%; D2 31%; D3 8%; top states by volume: NY 11% FL 5.6% NC 4.6% IA 4.5% MO 4.1%; CA only 4% international despite 147 teams; 68 recruiting agencies identified 85% founded since 2000 charging $500-$3500; womens programs grew from 103 in 1982 to 1000+ by early 2000s (Title IX)"
